{
  "$schema": "https://json-schema.org/draft/2020-12/schema",
  "title": "Digital Asset Runtime Pipeline",
  "type": "object",
  "required": [
    "schema_version",
    "artifact_id",
    "artifact_version",
    "steps"
  ],
  "properties": {
    "schema_version": {
      "type": "string",
      "const": "v1"
    },
    "artifact_id": {
      "type": "string"
    },
    "artifact_version": {
      "type": "string"
    },
    "steps": {
      "type": "array",
      "items": {
        "type": "object",
        "required": [
          "step_number",
          "name",
          "input",
          "output",
          "responsible_system",
          "failure_mode",
          "fpg_responsibility"
        ],
        "properties": {
          "step_number": {
            "type": "integer"
          },
          "name": {
            "type": "string"
          },
          "input": {
            "type": "string"
          },
          "output": {
            "type": "string"
          },
          "responsible_system": {
            "type": "string"
          },
          "failure_mode": {
            "type": "string"
          },
          "fpg_responsibility": {
            "type": "string"
          }
        },
        "additionalProperties": false
      }
    }
  },
  "additionalProperties": false
}
